Rank,Name,Genre,Publisher,NA_Sales,EU_Sales,JP_Sales,Other_Sales,Global_Sales
2970,Frozen: Olaf's Quest,Platform,Disney Interactive Studios,0.28,0.35,0.0,0.06,0.69
4058,LEGO Marvel Super Heroes,Action,Warner Bros. Interactive Entertainment,0.28,0.17,0.0,0.04,0.49
6771,Disney's Planes,Simulation,Disney Interactive Studios,0.13,0.1,0.0,0.02,0.25
6966,The Smurfs 2,Platform,Ubisoft,0.0,0.21,0.0,0.02,0.23
8991,Moshi Monsters: Katsuma Unleashed,Action,Activision,0.0,0.13,0.0,0.02,0.15
11538,The Croods: Prehistoric Party!,Misc,D3Publisher,0.03,0.04,0.0,0.01,0.08
14103,Turbo: Super Stunt Squad,Sports,D3Publisher,0.0,0.03,0.0,0.0,0.03
14355,LEGO Legends of Chima: Laval's Journey,Adventure,Unknown,0.0,0.03,0.0,0.0,0.03
16304,Fireman Sam: Action Stations,Action,Avanquest Software,0.0,0.01,0.0,0.0,0.01
