Rank,Name,Genre,Publisher,NA_Sales,EU_Sales,JP_Sales,Other_Sales,Global_Sales
1305,Triple Play 99,Sports,N/A,0.81,0.55,0.0,0.1,1.46
1992,Legacy of Kain: Soul Reaver,Action,Eidos Interactive,0.58,0.4,0.0,0.07,1.04
5863,The Dukes of Hazzard II: Daisy Dukes It Out,Racing,Unknown,0.17,0.11,0.0,0.02,0.3
8159,Twisted Metal: Small Brawl,Action,Unknown,0.1,0.07,0.0,0.01,0.18
8555,Alone in the Dark: The New Nightmare,Adventure,Infogrames,0.09,0.06,0.0,0.01,0.16
11078,Action Man-Operation Extreme,Action,N/A,0.05,0.03,0.0,0.01,0.09
13674,B.L.U.E.: Legend of Water,Adventure,N/A,0.0,0.0,0.04,0.0,0.04
